<?xml version="1.0" encoding="UTF-8"?>
<!ELEMENT fasce (fascia+)>
<!ELEMENT fascia (ora_inizio, ora_fine)>
<!ATTLIST fascia 
          timeID NMTOKEN #REQUIRED>

<!ELEMENT ora_inizio (#PCDATA)>
<!ELEMENT ora_fine (#PCDATA)>